grn_001.jpg	Set de tereré (guampa ha termo) oĩva peteĩ mbyky ári. Ko’áva ha’e peteĩ tembipuru iñemíva teko paraguaigua rehe, oñemoambue haguã ha oñembopyhu haguã pyhareve térã ka’aru.
grn_002.jpg	Peteĩ ta'ãnga morotĩ hína, ha pe kuña oguereko peteĩ herapyra yvate. Ko ta'ãnga ohechauka pe mbarete ha pe tekopyhu Paraguái peve.
grn_003.jpg	Puesto jagua pehógui, oĩva heta pohã ñana ha tembi'u Paraguái pegua. Ko'ápe ojehecha umi yvoty ha ra'a pohã, ha umi bolsa michimi oje'ãva yvate gotyo.
grn_004.jpg	Umi mandioca ha pohã ñana ojehejape peteĩ merkádope. Ko'ãva ha'e tembi'u ha remedio tekotevẽva teko paraguaíguape.
grn_005.jpg	Peteĩ ta'ãnga religioso, oĩva peteĩ ao pypuku pypuku pytã ha sombrero mbo'ehápe cross oĩva. Ko ta'ãnga oĩ peteĩ mesa ári, oñemoĩva peteĩ ao po'i rendy ha peteĩ kandela michimi.
grn_006.jpg	Umi tapicha oñemoambue haguã pe rógui, omoambue hína pe rakáre. Ko mba'e ohechauka pe teko Paraguáipe, where workers repair walls in a community space.
grn_007.jpg	Peteĩ ava oguata hovyra'y rupi, pohã ñana ha tekopygua rehe. Ko tembiapo ohechauka pe ñande reko ha ñane retã rekove.
grn_008.jpg	Peteĩ ta’ãnga guasu oñemombo’éva yvyra rakãre, ojehecháva umi tapicha renonde. Ko mba’e ikatu ojehecha peteĩ jepokuaa térã peteĩ tembiapo ojekuaáva yvága ha yvy retãme.
grn_009.jpg	Peteĩ chipa, tawa'i yvytu ha kesúgui ojejapóva, oĩva peteĩ papépe. Ko tembi'u ha'e peteĩ mba'e tee teko paraguaiguápe.
grn_010.jpg	Peteĩ opaíra ha opaîra oñemoî peteĩ óga yvytu rupi, kokuépe. Ko ta'ãnga ohechauka pe teko rural ha pe mborayhu oĩva umi família Paraguái retãme.
grn_011.jpg	Sopa paraguaya, peteĩ pan maíz ha queso ha'éva tembi'u tradiconal Paraguaype. Ko tembi'u ojehecha heta hendápe, oikove haguã teko porã ha ñande reko.
grn_012.jpg	Peteĩ pýre oĩ arroz ha guiso, tembi'u ojejapóva mandioca ha maíz rupive. Ko tembi'u omombe'u pe teko paraguayguápe, ojejapóva hetaiterei jaguaregui.
grn_013.jpg	Sopa paraguaya reínte, peteĩ tembi'u pyahúva ha iñemboguapy maíz rupive. Ko tembi'u oĩ hína pe tata rendápe, ohechauka haguã pe teko paraguaygua.
grn_014.jpg	Peteĩ mbo'eha haku hína, oikóva Paraguáipe, ndive heta tembipuru ha artesanía opaichagua. Ko'ápe ojehecha umi mba'e oñembohapévape, imbareteháva pe teko paraguaiuáre.
grn_015.jpg	Peteĩ mbo'ehára mango pyahu oĩ peteĩ mesa yvyra ári, tape gotyo. Ko'ápe ojehecha mba'e ojevendévape, ikatúva ojekuaa peteĩ mercado térã vy'a'e Paraguáipe.
grn_016.jpg	Peteĩ kuimba'e oguerekóva tembiapo poíva, oñembo'y haguã tape rendape umi jaguarete ha yvytu kuéra ojevendéva. Ko tembiapo ohechauka pe tekoporã ha umi aranduka oikóva Paraguay retãme.
grn_017.jpg	Heta maní tasta, oikóva tembi'u ryguasu ha mbo'ehára Paraguáype. Ko tembi'u ikatúva ojehecha heta hendápe, umi mercado-pe ha tembi'u ñembohory rupive.
grn_018.jpg	Pe ñandutí ha'e peteĩ ao po'i mbo'ehára, ikatúva ojehecha hína ko ta'ãngape. Ko artesanía paraguaya ojehecha hína iñandutíva, ha ojehecha heta color ryguasu.
grn_019.jpg	Pe ñandutí ha'e peteĩ ao po'i porã, ojejapóva hína ñandúpe ikatúva. Ko tembi'u mbo'ehára ohechauka pe teko paraguaigua ha iñe'ẽgua.
grn_020.jpg	Peteĩ ta'ãnga yvyra rupi, oĩva peteĩ kora pype. Ko mba'e ohechauka pe tembiapo mbo'ehára ha pe tekoha guaraní.
grn_021.jpg	Umi yvyra-yvoty yýpe oiko, ikatúva ojehecha peteĩ greenhouse-pe. Ko'ãva ha'e yvoty yguasu, ikatúva oñemoandúva umi yvoty yýpe oikóva ñande retãme.
grn_022.jpg	Yvoty hovykuáva oñemyasãi peteĩ ra'angapyrãme. Ko'ã yvoty ha pe yvyra hovy rupi, ohechauka pe tekoha porã ha pe ñayorũ guasu oĩva Paraguay yvyre.
grn_023.jpg	Ruina kuéra katu yma guaso, itavyra puku ha hovyra yvoty. Ko tenda ohechauka pe tekoha yma, oiko haguã umi ava Guaraní ha umi Spanish kuéra.
grn_024.jpg	Kuña kuéra oñembosára haguã peteĩ danza folklórica, oñemongu’e haguã botýla iñakã ári. Ko danza ha’e pe "danza de la botella", ikatúva ohecha haguã oreteko ha orekyhyje Paraguáipe.
grn_025.jpg	Peteĩ kuña oĩ hína peteĩ ao po'i ha ao ñembosarái guasu, ojehechaukávo pe danza folklórica paraguaya. Oĩ ha'e peteĩ banner renondepe, ombojoja haguã pe ritmo ha pe cultura regional.
grn_026.jpg	Peteĩ yvotyro'y porã oĩ peteĩ tape ndive, pyhareve ojehechávo. Ko yvoty repyvóva omohesakã pe tekoha Paraguái peve, henihápe pe yvy ha pe yvytu oiko py'aguapýpe.
grn_027.jpg	Two people wearing straw hats are eating a traditional stew served with sliced mandioca and lime. The meal is shared on a rustic wooden patio, reflecting the communal and rural aspects of Paraguayan culture.
grn_028.jpg	Ta'ãnga Pombero rehe, peteĩ espíritu karaiete oĩva haguã kapi'ipe ha monte rupi. Ko figura representa pe mito guaraní protector ha travieso, oikóva Paraguay yvyre.
grn_029.jpg	Peteĩ yvoty porã, héra Passiflora, oĩva ñande yvy gotyo. Ko yvoty iñemíva ha iñambueháva, ohechauka ñande rekove ha ñande tekoha pyahu.
grn_030.jpg	Peteĩ guyra michimíva, kapi'i sa'y guasu rekove rehe, oñemboja haguã yvotykuérape. Ko guyra repy'a ha iñyrũ ombohecha ñande rekove tee ha pe tekoha porã.
grn_031.jpg	Pe edificio clásico, ojehecha pyhareve, oguereko umi pilar guasu ha peteĩdome yvate. Ojehai "FIDES ET PATRIA" upe renondepe, ha oñemboja luz violeta ha rosa.
grn_032.jpg	Peteĩ ta'ãnga yvyra rupive, ohechauka haguã peteĩ ava mbo'eha Paraguái pegua. Ko tembi'u ojehecha hetaiterei umi tendápe ojekuaahápe tekoha guaraní.
grn_033.jpg	Peteĩ óga kué katu, hína hupáha ha yvyra, oĩva ka'aguýpe. Koite mba'e rupive ojehecha pe tekoha guaraní ha pe tekoporã rekove yma guare.
grn_034.jpg	Heta tapicha, oikóva oikóva oñemohenda rupi, oñembo'y peteĩ tata michĩ renondepe. Ko ta'ãnga ohechauka pe teko pyahu ha pe teko yma oiko oñondive peteĩ tekoha rupi.
grn_035.jpg	Peteĩ opaite mbo'eha opaite tembiapo ha vy'apavẽme, umi ava kuéra oñemoĩ va'erã peteĩ ryru rupive. Ojehecha hikuái oñembosako'i ha oñembopyhu'ã ha'e haguã peteĩ teko porãme, opaite age ojehechávo.
grn_036.jpg	Peteĩ guampa yvyrãme oĩva, ha ndive peteĩ bombilla. Ko tembipuru ojeipuru tererérã, ha ipu'ãva pe bandera Paraguái.
grn_037.jpg	Peteĩ platopa tembi'u Paraguái peguá, oĩhápe cuscús ha katu katu peteĩ guiso hovyha, oñembohe'ẽva peteĩ tupa haguã. Ko tembi'u iñemohendarupive ohechauka pe teko paraguaigua rembi'u.
grn_038.jpg	Peteĩ plázape oguata umi tapicha, oĩhaguã peteĩ iguaasuva ha dome guerekóva iñakãre. Ko ára hína peteĩ tenda oñemoîhápe umi tapicha oñembosáro ha oñembosarái haguã.
grn_039.jpg	Peteĩ kágui rupi oĩ umi chipa, tembi'u teete Paraguay pegua. Ko'ãva ha'e tembi'u ojeipurúva heta arandukápe ha oñemoĩva chipa ra'ápe.
grn_040.jpg	Peteĩ tataata potyva, oĩva ka'aguýpe. Ko tembipuru ojeipuru haguã tembi'u oñembo'ehápe, ha ohechauka pe teko Paraguaya rekove rupi.
grn_041.jpg	Peteĩ ta'ãnga pytu’u ha mimbíva, ojejapo hína yvyra'y rupive. Ko mba'e ohechauka pe tembiapo ryguasu ha pe teko Paraguái vakáre.
grn_042.jpg	Peteĩ guasu mbo'ehára ha iñyvoty michĩmi, yvyra kapi'ipe ári. Ko ta'ãnga ohechauka pe mborayhu ha pe ñangareko, ikatúva jahecha ñande rekove ha ñande tekoha Paraguáipe.
grn_043.jpg	Peteĩ mitã rubyháva, Jasy Jateré, oĩ yvotykuápe peteĩ bastón rupive. Ko ta'ãnga ohechauka peteĩ tekove mýrã guaraníva, umi mitã ombohovái haguã pe siesta rupi.
grn_044.jpg	Sopa paraguaya, peteĩ tembi'u tekohápe ojekuaáva, hína pe pan maíz ha queso rupive ojejapóva. Ko tembi'u omombe'u pe teko porã ha pe joajopýva Paraguáipe.
grn_045.jpg	Dos mujeres con vestimentas tradicionales de color blanco sentadas en un entorno natural. Sus prendas reflejan la sencillez y el vínculo con la naturaleza propios de la cultura guaraní.
grn_046.jpg	Peteĩ óga michimíva, yvyra ha kuatia rupive ojejapóva, oĩva ka'aguýpe. Ko mba'e ohechauka pe teko yma guare ha pe mbo'ehupyty ñane retãme.
grn_047.jpg	Peteĩ guyra michĩ oĩ peteĩ ta'ãnguáre. Ko ta'ãnga ha pe guyra ohechauka pe tekoha ha pe tekoporã oĩva ñande rekove rupi.
grn_048.jpg	Peteĩ kuña oĩ peteĩ óga michimíva renondepe, ojejapóva yvyra ha paja rupive. Ko óga rupi ojehecha pe tekoha rural ha pe tembiapo traditional guaraní.
grn_049.jpg	Vori vori, peteĩ tembi'u Paraguái teete, oĩva peteĩ platoymépe. Kóva ha'e peteĩ caldo hovykuáiva, oguerekóva bolitas ojejapóva avati ha queso rupive.
grn_050.jpg	Mandioca kapi'y, tembi'u Paraguáipe heta oipuruháva. Ko yvyra iñandutíva ha'e pilar fundamental teko paraguayugua rekovepe.
