grn_001.jpg	Peteĩ tereré guampa ha termo oĩva peteĩ kãtyrépe. Ko tembi'u ha y haku-ro'y ha'e peteĩ tekoporã Paraguáipe, oñemboja haguã tapicha kuéra.
grn_002.jpg	Peteĩ ta'ãnga kuimba'e ha kuña oĩva yvaga hũme. Ko ta'ãnga ohechauka pe mborayhu ha pe mbarete oĩva Paraguái retãme.
grn_003.jpg	Heta pohã ñana ha tembi'u oĩ ko tendápe. Ko'ãva ojeipuru pohãrã ha ojehecha jepi umi mercado Paraguáipe.
grn_004.jpg	Heta mandioca oĩ aripakape. Ko tembi'u ha'e peteĩ pilar fundamental tekoha paraguaiguápe.
grn_005.jpg	Peteĩ ta'ãnga San Cayetano, oĩva peteĩ ao pytã guasu reheve. Ko mbo'ehára ojehechakuaa Paraguáipe tekoporã ha tembi'u ñemongu'éva rupi.
grn_006.jpg	Umi kuimba'e omba'apo hína pe óga pypýpe. Oñemongu'e hína pe yvyra ha pe pared, ohechauka haguã tekoporã ha mba'apo pyahúva.
grn_007.jpg	Peteĩ kuimba'e oguata hína tata pytã ári. Ko tembiapo ojehecha heta hendápe Paraguáipe, ohechaukávo imbareteha ha iñemyasãiha.
grn_008.jpg	Peteĩ tata tuicháva oĩ yvy ári, umi tapicha ryepýpe. Ko'ã mba'e ojehecháva oñemohenda hína peteĩ jepuru kultural Paraguáipe.
grn_009.jpg	Peteĩ chipa oĩ peteĩ papél pytã ári. Ko tembi'u ha'e peteĩ pan almidón ha queso, ojehechaukáva teko paraguái.
grn_010.jpg	Peteĩ óga yvyra ha paja rupive ojejapo va'ekue, umi tapicha ndive oĩva hendápe. Ko'ãva ha'e hína teko paraguái ha guaraní ymaite guive oikóva.
grn_011.jpg	Sopa paraguaya, peteĩ tembi'u tekoha paraguáigua ojejapóva avati ha queso rupive. Ko pan maíz ha'e tembi'u imbareteva ojejapóva pyhareve ha ojeheñóva opaite ñemongeta ha jere ndive.
grn_012.jpg	Peteĩ plato oĩva arroz ha so'o haguã, tembi'u Paraguái pegua. Ko tembi'u ha'e peteĩ mba'e ojejapóva opaite rógape.
grn_013.jpg	Peteĩ pedazo sopa paraguayáva, tembi'u ombojevapýva teko paraguáigua. Oĩ pe tembi'u iñembojoapy reheve, ha ovai yvotykuéra pyhareve.
grn_014.jpg	Peteĩ tembiapo ha artesanía aty oĩva peteĩ rendápe. Ojehecha heta mba'erepýva ha tembiapo rogúi, ohechauka haguã pe cultura ha teko paraguaigua.
grn_015.jpg	Heta mango oĩ peteĩ mesa yvyrápe. Ko'ãva ha'e tembi'u ojehecháva jepi umi mercado ha tape hendápe Paraguay-pe.
grn_016.jpg	Peteĩ kuimba'e oñemohenda haguã iñembipuru ñemoñemu ha iñembohasy haguã tape hendápe. Ohechaukávo heta mba'e ojejapo ha'e haguã yvyrýgui, ha'éva tembiapo Paraguái-gua.
grn_017.jpg	Heta maní oĩ ko ta'angape. Ko tembi'u ojeipuru hetaite chipa ha ambue tembi'u Paraguái-pegua rupive.
grn_018.jpg	Pe ñandutí ha'e peteĩ ao po'i ojejapóva po rupive, oñembojegua va'ekue telara'ãicha. Ko mba'eporã'apo ohechauka Paraguái rekovapýra ha iñakãrasy.
grn_019.jpg	Ko ta'ãnga ohechauka ñandutí, peteĩ ao po'i porãite ojejapóva pyraguýgui. Ko mba'eporã'apo ojehechakuaava ha'e Paraguái rekuaíre.
grn_020.jpg	Peteĩ yvyra-mbo'ehára ohechaukýva pe Mbói Tu'i, pe mbói ha guyra joajuva mombe'úpe. Ko ta'ãnga oñemohenda yvy gotyo, tekoha rupi.
grn_021.jpg	Heta yvoty yvýre oĩva yupe, oñeme'ẽva tekoha porã ha pyraguýva. Ko ta'ãnga ohechauka ñande reko ha ñande reko porã tekoha ndive.
grn_022.jpg	Umi yvoty hovy oĩ pe ñu mbytépe. Ko'ã yvoty ha yvyra rupi oñemondýva ha ohechauka pe tekoha porã.
grn_023.jpg	Umi mbo'ehao yma rekovai, oĩva Paraguái yvy ape ári. Ko'ã tembo'ehaokue ohechauka umi Guaraní ha española rekove joaju.
grn_024.jpg	Umi kuña ojeroky hína pe danza de la botella-pe, omoĩvo peteĩ botella iñakã ári. Ko mba'eporã ohechauka hikuéra reko marangatu ha ipokatu.
grn_025.jpg	Peteĩ kuña ojeroky ha ohechauka iývola porãva. Ko ta'ãnga ohechauka pe danza folklórica ha pe cultura paraguáigua.
grn_026.jpg	Peteĩ yvotyra morotĩ oĩ tape hendápe. Ko yvotyra iporãite ha ohechauka Paraguái yvyra porãkuéra.
grn_027.jpg	Mokõi tapicha okaru peteĩ tembi'u porãva, oĩva aripakape. Oĩ upépe vori vori ha mandioca, tembi'u Paraguái-gua hekopegua.
grn_028.jpg	Peteĩ Pombero ta'ãnga oĩ apytégui. Ko espíritu del monte ha'e peteĩ figura tuicha Paraguái mombe'úva, ojeikuaava protector ha avei travieso rekove rupi.
grn_029.jpg	Peteĩ yvoty porã oĩ yvype. Ko yvoty ha'e peteĩ mba'e ojehecháva Paraguái yvyrembyrype.
grn_030.jpg	Peteĩ guyra hovy, iñakã hũ ha ijyva puku, oñemboja hína yvoty rupi. Ko guyra ha'e peteĩ mba'e porã yvy ape ári, ohechauka ñane retã rekove ha iñangareko.
grn_031.jpg	Peteĩ kuatiahaipyre tuicháva, ojehechauka haguã tekopytã ha mborayhu tetãre. Ko ta'ãnga ohechauka pe mbo'ehapi Paraguáipe, oñembojoja haguã yma ha ko árape.
grn_032.jpg	Peteĩ ta'ãnga yvyra rupive ojejapóva, ohechauka haguã peteĩ kuimba'e yma rete. Ko mba'eporã'apo omoakã pe arandu ha tembiapo traditional guaraní.
grn_033.jpg	Peteĩ óga tuja oĩva ka'aguýpe, ojejapo haguã yvy ha yvyra rupive. Ko óga ha'e peteĩ tekoha, ohechauka haguã pe teko porã ha pe rekove ymaite guáicha.
grn_034.jpg	Umi mitã ha tapicha oñemboja peteĩ tata yvate gotyo. Ko ñemongeta ha oñondivepy ohechauka pe teko porã ha pe komunitasýra mbarete.
grn_035.jpg	Heta mitã ha tapicha ojeroky peteĩ tata yvate gotyo. Ko tembiapo ohechauka pe teko porã ha pe joaju komunitasape.
grn_036.jpg	Peteĩ guampa tereré oĩ aripakape, kuatia ñe'ẽ kuéra renondepe. Pe guampa ohechauka pe Paraguái bandera ha ojeipuru tereré inupã hag̃ua.
grn_037.jpg	Peteĩ platopa oĩva ko ta'angape, oguerekóva so'o ha tembi'u yvyregua. Ko tembi'u ha'e hína tekoha paraguáigua, ojejapóva yvyra ha yvy gotyo rekove rupi.
grn_038.jpg	Heta tapicha oguata upe tava guasu rendápe, peteĩ tupao guasu renonderã. Ko ta'ãnga ohechauka pe tekopygua ha pe oiko haguére Paraguáipe.
grn_039.jpg	Umi chipa oĩ peteĩ tupa-pe. Ko tembi'u ha'e peteĩ rembi'u Paraguái-gua ojejapóva almidón ha queso-gui.
grn_040.jpg	Peteĩ tatao yvy rape rupi ojejapóva, ojeipurúva tembi'u ñembo'épe. Ko mba'e ohechauka pe tekoha ha pe tembiapóva yvy ape ári.
grn_041.jpg	Peteĩ kapi'i térã kure mbegue poty, ojejapo yvyra ha hũ. Ko tembipuru ojeipurúva yvy ape ári, oñembojoja va'erã teko paraguayguápe.
grn_042.jpg	Peteĩ guyra guasu ha imbyry oĩ yvyra puku ári. Ko ta'ãnga ohechauka ñande rekove ha ñande yvyrakuéra ñangareko.
grn_043.jpg	Peteĩ mitã ruby, Jasy Jateré ha'éva, oĩ ka'aguýpe. Ko mombe'úva oñe'ẽ mitãkuérape ani haguã osẽ ka'aguýpe siesta jave.
grn_044.jpg	Mbejú hína ko tembi'u, ojejapóva almidón ha queso rupive. Ha'e peteĩ tembi'u porã ojejapóva Paraguáipe.
grn_045.jpg	Mokõi kuña oĩva yvyraty mbytépe, oñembojegua ao po'i pyahu rupive. Ohechaukávo hikuéra tekoha guaraní reko, oñembojoaja haguã yvy ha tekove porã.
grn_046.jpg	Peteĩ oga michĩmi yvyra rupive ojejapo va'ekue, oĩva ka'aguýpe. Ko mba'e ohechauka pe tekoha ha umi tembiapo ymaite guive oĩva ñande retãme.
grn_047.jpg	Peteĩ guyra oĩ peteĩ óga michĩva ári. Ko'ã guyra ha yvyra kuéra ha'e hína ñande rekove ha ñande tekoha imarangatúva.
grn_048.jpg	Peteĩ kuña oĩ peteĩ óga tuja yvyra ha paja rupive ojejapóva. Ko óga ha'e hína tekoha, hekópe oiko umi tapicha guaraní.
grn_049.jpg	Peteĩ platoga vori vori, tembiʼu Paraguái-gua ojejapóva maíz ha queso-gui. Ko sopa haku oñembojoapy heta yvotyra ndive, ha haʼe peteĩ tembiʼu imbareteva ha ojehechauka haguã ñande reko.
grn_050.jpg	Umi mandioca kuéra oĩ oñembojapóva. Ko tembiʼu haʼe peteĩ pilar fundamental teko paraguaigua rupi.
