grn_001.jpg	Peteĩ termo ha peteĩ guampa oĩva peteĩ kapi'i ári. Ko'ã tembipuru ha'e tereré rembiapo, ha omboja'e haguã umi tapicha oñemohenda jave. Ha'e peteĩ tekoha imarangatuva ha iñambueva Paraguái ha umi yvy Guaranípegua.
grn_002.jpg	Peteĩ ta'ãnga yvytu gotyo, oîva peteĩ kuña ha peteĩ mitã. Ko mba'e omombe'u ñande retã Paraguái reko ha iñe'ẽnguru mborayhu rehe. Ohecha umi tapicha omba'apo ha oñemohenda haguã py'aguapy ñande yvy ape.
grn_003.jpg	Peteĩ ñembohasa tembi'u reko Paraguáipe. Ojehecha umi yvoty, ra'a ha tembi'u ojehechauka haguã ojevendévo. Ko'ãva ha'e umi tembi'u tekoregua ojeiporúva ñande reko ha ñande rembi'u pyahu ha tee.
grn_004.jpg	Umi mandi'o ha yvoty various ojehecha peteĩ feria rupi. Ko'ã tembi'u ha yvoty ha'e umi ñembo'e ha teko Paraguái ha Guaraní rekovape. Ojeiporúva tembi'u ha avei opaite mba'e pyahu haguã.
grn_005.jpg	Peteĩ ta'ãnga San Martín de Porres rembiapo. Ko ta'ãnga ojehecha heta rogayguakuérape ha mbo'ehaoguápe Paraguay pegua, ojehecha chupe oñemoĩva hese peteĩ mbyky puku pyahu ha puku pyahu pypo. Ohechauka pe tembiapo ha pe ñemohenda imarangatuveva Paraguái retãme.
grn_006.jpg	Umi tapicha oñembosako'i haguã peteĩ tembi'u róga renondepe. Ko mba'e ohechauka pe tembiapo guasu ha pe joaju oikovape Paraguáipe. Oñemboporã haguã hikuái upe tenda oikóvape.
grn_007.jpg	Peteĩ tava oñembopytáva tata pytã ári. Ko tembiapo ha'e peteĩ jepytaso imarangatuva ha iñambueháva teko Paraguái ha Guaraní rekoveme. Ohechauka pe tenderness ha pe mbarete oguerekóva pe tava tata ndive.
grn_008.jpg	Peteĩ ta'ãnga oĩva yvy ári. Ko mba'e oñembo'y haguã ha oñemoambue haguã, oñemboha'ãva opaichagua tembi'u ha tembipuru oñembohapéva. Ko'ápe ojehecha pe tekove ha pe py'aguapy oñemohendáva Paraguái retãme.
grn_009.jpg	Peteĩ chipa oĩ peteĩ kuatia puku ári. Ko tembi'u ha'e peteĩ chipa Paraguái, ojejapóva mandi'o ha queso rupive. Ha'e peteĩ tembi'u imbareteva ha iñandutýva, ojejapóva hetave aravo pyhareve.
grn_010.jpg	Peteĩ óga yvyra ha paja rupive ojejapóva. Ko'ã óga katu oñemohenda haguã umi tekoha guaraní Paraguáipe. Ojeipuru chupekuéra oiko hag̃ua ha oñemohenda hag̃ua tekohápe.
grn_011.jpg	Peteĩ chipa poty. Ko tembi'u ha'e peteĩ chipa Paraguái tekotevẽva umi aretekuérape, ha ojejapóva avati ha queso rupive. Ha'e peteĩ tembi'u imbareteva ha iñemohendarupive oje'u haguã ka'a ha tereré ndive.
grn_012.jpg	Peteĩ plato oĩva arroz ha vori kapi'i ndive. Ko tembi'u omombe'u pe tekoporã ha umi tembi'u ojejapóva Paraguáipe. Ha'e peteĩ tembi'u pyahu ha imarangatuva tapicha opaite rupi.
grn_013.jpg	Sopa paraguaya oĩva peteĩ tavyrãme. Ko tembi'u ha'e peteĩ chipa haku, oñemohenda maíz ha queso rupive, ha imbarete Paraguái retãme. Ojejapóva hína tata rupive.
grn_014.jpg	Peteĩ ñembo'eha tembipuru ha mbo'eha ñe'ẽnguru rupi ojekuaáva Paraguáipe. Ko'ápe oĩ heta tembipuru hovyha ha ñembipuru ryguasu, ohechauka haguã umi yvypórava ha ietekue teko. Oñemone'ẽ ko'ã mba'e rupi pe arandu yma ha pe teko Guaraní oikóva ko'ágã.
grn_015.jpg	Peteĩ mesa yvyráre oĩ heta manga iñasyva. Ko'áva ha'e tembi'u ojehecha heta Paraguáipe, ha ojevendéva umi tape rembe'ýpe. Ohecha upe ñembosarái sãmbyhyteva Paraguái retãme.
grn_016.jpg	Umi tembi’u ha tembipuru yvytu rupi oñemovenda haguã pe tape gotyo. Ko’ã tembi’u ha tasy ha'e hikuái peteĩ mba'e ojejapóva kuatia ha yvyra rupive, ohechauka haguã pe teko ha tembiapo paraguaigua. Ojehecha ko’ã tembi’u rupive pe mborayhu ha pe ñepy'apy oĩva umi artesano kuéra renondépe.
grn_017.jpg	Umi maní taty. Ko mba'e ikatu ojejapóvo tembi'u katuete ha oñemboja haguã umi tapicha Paraguaype. Ojeipuru heta oveve ha tembi'u tekóre.
grn_018.jpg	Peteĩ ñandutĩrĩ ojehecháva, ojekuáre heta sa'y rupive. Ko ta'ãnga ha'e peteĩ tembiapo arandupy Paraguái pegua, ojehechauka haguã pe teko ha tembiasakuéra. Ojeipuru haguã umi mba'e ojehecharamo'ãva ha ojehai haguã umi tape mimbivate.
grn_019.jpg	Peteĩ ñandutápe ñe'ẽmbyra ojehecha. Ko ta'ãnga ha'e peteĩ mba'e imarangatuva Paraguái ha Guaraní kultúrape, ojejapóva po pype. Ohechauka pe tembiapo imbareteva ha umi color opaichagua.
grn_020.jpg	Peteĩ ta'ãnga yvyra rupi, ojehechaukáva peteĩ mymba guasu. Ko mba'e ohechauka pe mbo'eha ha pe tembiasu guaraní, oñemohenda haguã umi iñe'ẽ ha iñangareko yvyre. Ojekuaa haguã pe teko paraguaigua ha iñangareko iñe'ẽre.
grn_021.jpg	Peteĩ ysyry michimi oĩva mbo'ehaogua rupi, oguerekóva umi yva'a guasu ha hovy. Ko'ã yva'a ha ysyry kuera oñemombe'u Paraguái rembi'u ha teko ha'eha peteĩ mba'e imarangatuva ñande rekove rupi. Ko ta'ãnga ome'ẽ ñandeve pe tekove ha pe py'aguapy yvytu ha y rupive.
grn_022.jpg	Umi yvoty hovyvéva ojehecha peteĩ jardíni rembe'ýpe. Ko'ã yvoty oñembo'ete heta hendápe Paraguáipe, omombe'u haguã pe tenderness ha pe tenderness oikóva umi tekove iñemohendarupíva. Ko ta'ãnga ome'ẽ peteĩ sentimentu py'aguapy ha tekove iñambyýva.
grn_023.jpg	Umi Jesuitas mbo'eha ru'ã rembiro ra'ã. Koitápe ojehecha umi tape ha tembo'eha oikóva Paraguáipe, omombe'u haguã pe ára yma guare. Ko'ãva ha'e peteĩ mba'e imbareteva ñande reko ha ñande reko mbo'eha rupive.
grn_024.jpg	Umi kuña kuera oñembopyry haguã pe danza Paraguái. Oguereko peteĩ poty yvoty iñakã ári, ikatúva oje'e "botella" ha'éva peteĩ tembiapo mbo'ehára ñemongu'e. Ko tembiapo ohechauka pe mborayhu ha pe tekoporã guaraní ha paraguái.
grn_025.jpg	Peteĩ kuña oñembopytyvõ haguã pe chamamé dancing. Omoĩ peteĩ ao ryguasu ha iporãite, ojehecha haguã pe cultura regional. Ko ta'ãnga ohechauka pe mborayhu ha pe ritmo oimeva Corrientes ha Paraguay pegua.
grn_026.jpg	Peteĩ lapára (Lapacho blanco) oñemohendáva peteĩ tape rendápe. Ko yvyra ha'e peteĩ símbolo Paraguái ha guaraní rembiapo, ohechauka pe ara pyahu ha pe kyre'ỹ. Oike hína ñane retã rekove ha tekohápe.
grn_027.jpg	Peteĩ mesa yvate gotyo ojehecha umi tapicha oreko haguã peteĩ tembi'u Paraguái teete. Oime peteĩ kapi'i poty (sopa paraguaya) ha mandi'o, umi tembi'u imarangatuva ha iñepyrũva tekoha guaraníme. Ko ta'ãnga omombe'u pe ñembapora ha pe joaju oikóva umi famíliape.
grn_028.jpg	Pe ta'ãnga ko'ãva ha'e pe Pombero, peteĩ tekoháre oje'e haguãva Paraguái ha umi tetã oikóva ko yvy ape. Ha'e ha'e peteĩ yvytu térã añangúcha oñangareko va'ekue umi ka'aguy ha mymbakuérare. Ko'ãva oje'e ha'eha peteĩ ava michĩmi ha hovy, ha umi tapicha omoĩ chupekuérava tabaco ha ka'a haguã oipytyvõ chupekuéra.
grn_029.jpg	Peteĩ mburuvicha yvyra yvoty, oñandúva Passiflora. Ko yvoty imarangatu ha oñemoĩ heta hendápe Paraguay yvyre. Ojeipuru heta mba'e pohãrã ha ohechauka pe ñayru yvytu imarangatuva.
grn_030.jpg	Peteĩ mainumby michimi, iñembipuru sa'yvýva. Ko mainumby ha'e peteĩ mba'e imarangatuva ñande rekove ha ñande yvy pegua. Ojehecha hese pe ñande yvy guasu iñambue sa'yvape.
grn_031.jpg	Peteĩ temploty guasu, oĩva Paraguáipe, oñemohenda ha'eha upe ñe'ẽ "Fides et Patria" rupive. Ko ta'ãnga ohechauka pe mbo'eha ha pe tory oimehápe umi távaguasu Paraguái pegua. Ojehecha ko yvypórara mbo'eha ha iñemohenda, omoheñóva pe tembiapo yma guare.
grn_032.jpg	Peteĩ ta'ãnga yvyra rupive ojejapóva, ha'e hína peteĩ ava guaraní. Ko mba'e ohechauka pe tembiapo mborayhu ha umi teko ñemoirũ Paraguái pehegui. Ojehecha ko'ápe pe arandu ha pe ñe'ẽndy yvyra rupive oñembohapéva.
grn_033.jpg	Peteĩ óga guaraní, ojejapo haguã yvy ha paja rupive. Ko óga imombe'u pe teko pyahu ha teko yma, oñemohenda haguã umi ava kuera iñe'ẽndy ha iñe'ẽre. Oime pe ka'aguy mbytépe, ojehechaukávo pe mborayhu ha py'aguapy tekoha rupi.
grn_034.jpg	Peteĩ grupo ava Guaraní oñemohenda peteĩ tata rendy renondepe. Ko tapicha kuera oñemohenda oñembojoapy haguã ha ombojy haguã imbarete ha iñe'ẽndy. Ko teko ha'e peteĩ mba'e imarangatuva ha oikove gueteri Paraguái ha ambue tetãme.
grn_035.jpg	Umi mitã ha tapicha kuera oñembosára peteĩ tata renondepe. Ko'ápe ojehecha peteĩ ñembojegua guaraní, ojehechápe hikuéra oñemohenda ha oñembosára tekotevẽ haguã oñembojoapy. Ko'ã mba'e ohechauka pe teko porã ha pe ñembosarái oimehápe pe cultura guaraní.
grn_036.jpg	Peteĩ mate guampa ha iñandu. Ko'ápe oje'u mate, tembi'u ha imombanguete Paraguái pevague. Ha'e peteĩ teko Paraguái ha Guaraní imbareteva, oñembojoaja haguã umi tapicha.
grn_037.jpg	Peteĩ plato chipa guasúgui ha akaraí ndive. Ko tembi'u ha'e peteĩ mba'e tipyry Paraguái pehecha haguã iñe'ẽndy ha iñakãrasy. Oñembojehe'i hína pe tekove ha umi mba'e ojehecha Paraguái retãme.
grn_038.jpg	Peteĩ tavaguasu rendy mbytépe oĩva umi tapicha ha peteĩ mbo'ehao guasu (iglesia). Ko'ápe hory hína pe tekopete Paraguái guasúpe, oñemohenda haguã umi tapicha mbo'ehao rendype. Ko'ápe ojehecha pe tekopete mborayhu ha pytyvõvape.
grn_039.jpg	Umi chipa pyahu oĩva peteĩ kapi'i ñatỹme. Ko tembi'u ha'e peteĩ mba'e iñambuevéva ha imarangatu Paraguái retãme, ojejapóva avati ha queso rupive. Oñembohasa hetave tapichakuérape ko tembi'u mbojegua, avei upe Chipa Rakegua ára.
grn_040.jpg	Peteĩ tata-pytu tatata rupi, ojejapóva yvyra ha yvytu rupi. Ko tembipuru oñemboguasu haguã umi tembi'u ha imbareteve haguã pe tata. Ko'ápe ojehecha pe teko Paraguái ha Guaraní rembiapo.
grn_041.jpg	Peteĩ ta'ãnga yvytu rupi oñembojapóva. Ko tembipuru oñembo'ýva tekopygua Paraguáipe ha umi pueblo nativo kuérape, oipuru haguã y térã ambue ysyry. Ha'e peteĩ mba'e omombe'u ñande reko ha ñande tee.
grn_042.jpg	Peteĩ ñandúva (tavapy) ha iñandupy michi oĩva peteĩ yvyra yvoty rupi. Ko guyra imbarete ha oñemohenda porã yvyra ha yvy rupi, ha'e hína peteĩ mba'e ojehecháva Paraguái yvyrembyremípe. Omoñandúva ñande reko ha ñande rekove tekoha.
grn_043.jpg	Peteĩ Kurupi ta'ãnga. Ko'ãva ha'e umi yvytu ha ka'aguy ánga, ojekuaáva Paraguái ha umi tetã Guaraní rembiapópe. Oje'e chupe oikove ka'aguýpe ha ome'ẽ haguã py'aguapy umi tekoha ndepy'aguapy'ỹvape.
grn_044.jpg	Peteĩ chipa guasu oñemohesãva. Ko tembi'u ha'e peteĩ mba'e iñambutapavẽva Paraguái ha umi tapicha Guaranípe, ojejapóva avati ha queso rupive. Ojehecha heta tenderness ha oje'u hína pyhareve katu.
grn_045.jpg	Mbohapy kuimba'e guaraní kuñe oñemoĩndy haguã tekoha pyahupe. Umi kuñe oñemoambyhy peteĩ ao mborayhu ha mbo'eha guasúpe, ohechaukóva tembi'u ha teko guaraní. Ko ta'ãnga ohechaukóva pe tekoreguáva ha pe mbo'eha kuñe rembiapo.
grn_046.jpg	Peteĩ ñu'ũ michimíva, yvyra ha taty rupive oñemohenda. Ko mba'e ohechauka umi tembikejaveva oiporava haguã hikuéra ryguasu térã ambue mymbakuéra kaguahépe. Ha'e peteĩ tembiapo oikove gueterãva Paraguái yvyre.
grn_047.jpg	Peteĩ guyra michimi oĩ peteĩ tata’ã rendy ári. Ko guyra ha pe yvyra iñemohenda ha’e hína ñane retã Paraguái rembiapo ha tekoha. Ohechauka ñande rekove ha ñane ndapavẽ yvytu ha yvýpe.
grn_048.jpg	Peteĩ ovevo kuatiaha ha ovevo pypo. Ko'ãva ha'e umi óga ojejapóva yvyra ha paja rupive, ojekuaáva umi pueblo nativo kuérape, ha'e hikuái pe teko guasu Paraguái pegua. Ohecha ko'ápe peteĩ kuña ovevo renondepe.
grn_049.jpg	Peteĩ plato Soopa Paraguaya, hína peteĩ yva’a hesakãva ha hendive umi mandi'o michimíva. Ko tembi'u ha'e peteĩ mba'e imarangatuva ha oñemoĩ heta rãre umi família Paraguái ndive. Ohechaukáva pe teko ha pe rembi'u imbareteva ko yvy apeguápe.
grn_050.jpg	Umi mandi'o kuera. Ko'ãva ha'e tembi'u tee Paraguáipe ha iñembohapavẽ Guaraní. Ojeiporúva hetaite tembi'u ha tekoporãme.
