grn_001.jpg	Mate yerba y термос (termo) revestido en cuero tejido. Es un elemento central de la socialización y la identidad cultural en Paraguay y regiones guaraníes. Se utiliza para preparar y compartir el mate en la vida cotidiana.
grn_002.jpg	Petẽi ta'ãnga guasu oĩva yvára pyahu rupi. Ko ta'ãnga orehecha Paraguái retã reko ha imbarete. He'i ñande retã rembiapo ha imbarete guasúre.
grn_003.jpg	Ojehecha petẽi ta'ãnga ha'éva petẽi vy'a hína, oñemovende ha'águi opaichagua yvyra rakã ha yvy ra'y. Ko'ã mba'e niko iñambue teko paraguaigua ha guaraníme, oñembohasa hikuái opaichagua pohã ra'y ha tembi'u. He'iháicha ñande ypykuéra, ko'ã yvyra rakã ikatú haguã oñemopy'apy ñande rekove ha ñande teko.
grn_004.jpg	Mandi'o ha yvaty kuéra oje'e haguã ñembo'eha goty. Ko'ãva ha'e tembi'u tee ha iñambue teko Paraguái ha Guaraní rembi'u rehe. He'i haguã, ko'ãva ha'e yvy pegua tembi'u hekãva ñande reko.
grn_005.jpg	Ko ta'ãnga ha'e peteĩ santo, oñemongeta ha oñemboheréva teko paraguaigua. Iñemíva ha iñemboheréva he'i ko'ápe pe mborayhu ha pe jerky ha'éva ñane retãme. He'i avei pe jesareko guaraní ha kristiyano oñemohendáva.
grn_006.jpg	Ojehecha peteĩ yvyra ha taryguy kuéra omoambuehávo peteĩ ta'ãnga. Ko tembiapo ohechauka pe ñembosako'a ha pe ñembohapýva teko Paraguáipe. Ha'e peteĩ mba'e oñemohenda haguã pe tekove pyahu ha pe tekoha oĩhápe.
grn_007.jpg	Peteĩ kuña okéva tata rupi. Ko’ápe ojehecha peteĩ tekoporã guaraní ha paraguayo, ojehechávo pe ñe'ẽndy ha pe mborayhu tata reheve. Ko tembiapo ha'e peteĩ tekorete ha tekopyhu oikóva ymaite guive.
grn_008.jpg	Peteĩ tata oñemanda haguã yvotykuápe, ojehecha hína pe tata guasu. Ko tembiapo ha'e peteĩ tekoteju ha ñembosarái guaraní teko Paraguáipe. Ojehecha ko'ápe pe tata reko ha iñangapy ñande reko rehe.
grn_009.jpg	Chipera hína ko chipa, tembi’u Paraguái ha Guaraní guasúva. Ko tembi’u itavy ha iñemboguapy mimbíva, ojehecha hetave pyhareve térã jave’a rupi. Ojehecha ko’ápe peteĩ chipa hovyra, oñemohenda peteĩ papel ypýpe.
grn_010.jpg	Una vivienda tradicional guaraní con techo de paja y paredes de madera. Estas estructuras reflejan la arquitectura ancestral adaptada al entorno natural de la región. Varias personas se encuentran reunidas junto a la construcción en un entorno rural.
grn_011.jpg	Sopa paraguaya. Ko ta'ãnga ha'e peteĩ tembi'u ryguasu ha imbarete, ojehechauka haguã pe teko ha pe rekove paraguaiguá. Ojejapóva avati ha queso rupive, ha imba'e tee oñembohasa haguã tekoha mbyry.
grn_012.jpg	Sopa paragua'i ha arroz. Ko tembi'u niko tekopyahu ha iñambientére oñembohasa haguã pe ñembosaráo Paraguáipe. Ha'e peteĩ tembi'u imbareteva ha omohenda haguã pe rogayguapy.
grn_013.jpg	Una porción de sopa paraguaya con relleno de carne y vegetales. Este plato es un pilar de la gastronomía guaraní y paraguaya, representando la fusión de ingredientes nativos y coloniales. Se presenta tradicionalmente en reuniones familiares y festividades culturales.
grn_014.jpg	Petẽva ha'e petẽi ñandutýra ha ta'ãnga opaichagua ojehecháva petẽi vendedora ypýpe. Ko'ã mba'e rupi ojehecha pe teko ha tembiapo guaraní, oñemohenda haguã Paraguái retãme. He'i pe tembiapo ñande reko ha ñande reko ha'e petẽi teko vy'a.
grn_015.jpg	Mangókuéra oñemoĩ peteĩ mesa yvytýre, Tape rupi. Ko yva iñambuete ha iñemíva teko paraguaigua, ojehecha heta tendápe. Ko'ápe ojehecha mba'éichapa oñemohenda umi yva ojevendévo.
grn_016.jpg	Un artesano guaraní exhibe tallas de madera de animales nativos al costado de una carretera. Estas piezas representan la fauna local y forman parte de la economía artesanal contemporánea de las comunidades. Es una manifestación del vínculo entre el arte, la naturaleza y la subsistencia en el territorio.
grn_017.jpg	Maní tatyra. Ko’ápe ojeipuru heta hendápe Paraguáipe, oñemoĩ hína tembi’u mimbivépe térã oje'u hína tembi'u jerevave. He'i hikuái ko'ápe peteĩ tembi'u imbareteháva.
grn_018.jpg	Heta ao pohy ha ao porã, he'i hína peteĩ ta'ãnga ñembopory. Ko'ã grove ha ovapi opaite kolorasy, ohechauka hína pe teko Guaraní ha iñe'ẽrã. He'i hína pe mborayhu ha pe tekoporã oĩva Paraguay pehepe.
grn_019.jpg	Detalle de un tejido artesanal con patrones geométricos en colores azul, magenta y amarillo. Esta técnica de tejido refleja la herencia cultural y la destreza manual presente en las comunidades guaraníes. Es un ejemplo de la expresión artística viva y contemporánea del pueblo.
grn_020.jpg	Ta'ãnga yvyra rupi, peteĩ jagua rupi ojehecháva. Ko tembiapo ohechauka umi ta'ãnga guaraní rekove ha iñemoîva ñande yvy Paraguái pevé. Ojehecha pe yvyra rembiapo ha pe ñemohenda kokuépe.
grn_021.jpg	Petẽi ysyry guasu ndive ndy’yvoty (Victoria amazonica) iñemíva. Ko yvoty katu ojehecha heta ysyryhápe Paraguay pegua, ha ojehecha hese petẽi mba'e ipu'ãva ha iñambueháva. Ko'ápe ojehecha pe tekoporã yvytu ha ysyry ndive.
grn_022.jpg	Yvoty hovykuáva ojehecha ko tavapy rupi. Ko'ã yvoty niko iñambueva teko ha iñapyrãva ñande reko ha ñande yvy Paraguáipe. Ohechauka pe ñande reko katuetekuápe ha ñande yvy yvotykuápe.
grn_023.jpg	Ruinas de una misión jesuítico-guaraní construidas en piedra arenisca roja. Estas estructuras representan el encuentro sincrético entre la cultura guaraní y la evangelización europea en la región. Son testimonios históricos de la organización social y espiritual de los pueblos guaraníes.
grn_024.jpg	Mujeres danzando con vasijas sobre sus cabezas en un espacio público frente a un lago. Esta expresión artística refleja la identidad y las tradiciones vivas del pueblo guaraní en Paraguay. La vestimenta colorida y el equilibrio simbolizan la gracia y la fuerza cultural de la comunidad.
grn_025.jpg	Petereĩ kuña oĩ hína peteĩ ao po'i ha itavyra guaraníme. Ko ao ha'e peteĩ mba'e ikatúva ojehecha dance-pe, omohenda haguã imba'erã ha imba'e rakã Paraguay guasúpe. Oĩ hína peteĩ cartel-pe "Mundial de Chamamé" he'íva, ohechaukávo ko tekoporã ha ko jeroky.
grn_026.jpg	Peteĩ yvyrávo hovy vai, iñapiyúva itatíva. Ko yvyráva ohechaukávo pe Paragon Paraguáipe ha iñemymba tekoasy ñande reko guaraníme.
grn_027.jpg	Petẽi mesa yma guasúpe oĩ va'erã tembi'u tekopygua: vori ha mbeju. Ko tembi'u omombe'u ñande reko ha ñande rapo Paraguái pegua. He'i hína pe família oñemohenda haguã oñembohapývo ko tembi'u.
grn_028.jpg	Figura del Pombero, personaje emblemático del folclore guaraní y paraguayo. Es reconocido como el guardián de la naturaleza y el bosque, a quien se le rinden tributos para obtener favores o evitar travesuras. Esta representación resalta su naturaleza mítica y su arraigo en la cultura popular contemporánea.
grn_029.jpg	Peteĩ passion flower (passiflora) yvoty, iñaveve porãvai. Ko yvoty ojehecha heta hendápe Paraguay pegua yvyre, ha ojeipuru avei pohã ha tembi'u rehegua. Ha'e peteĩ mba'e tekoha ñane retãme.
grn_030.jpg	Peteĩ mainumby michĩ, hovyvéva, oguapy hína. Ko mainumby ha'e peteĩ tekopygua imbareteva yvotykuérape ha ñande rekove ñanderehegua. Iñemíva tekoporã ha tekopygua guaraní rembiapópe.
grn_031.jpg	Peteĩ templete guasu, oñembohécha neandúva mboyve, ndiveいpe "Fides et Patria" he'íva. Ko ta'ãnga ome'ẽve pe tembiapo colonialism raretépe, ha ohechauka pe teko mbo'ehára ha pe religión oñemohendáva Paraguái retãme. Ko'ápe oñembojoaju pe cultura Europa ha pe teko paraguaigua.
grn_032.jpg	Talla en madera de una figura humana con rasgos tradicionales. Esta pieza refleja la artesanía ancestral y la conexión del pueblo guaraní con la naturaleza. Representa la identidad y la cosmovisión cultural persistente en la región.
grn_033.jpg	Oñave peteĩ óga guaraní, ojejapo yvyra ha tabaéva ndive. Ko ta'ãnga ohechauka pe teko Paraguái ha umi tembiapo oñembopyahuva'ekue. He'i haguã pe kulturápe, ko'ápe oiko pe tekove pyahúva ha pe yma.
grn_034.jpg	Petẽi opaite mbo'eha'ã guaraní, mitã ha tupãsykuéra, oñemoî petẽi tata yvytépe. Ko oñondivepýva ha'e petẽi tekoteĩ mbo'eha'ã ha ñemongu'e teko Paraguáipe. Ohechaukávo tembiapo ha ñe'ẽ guaraní, omopu'ã hikuái hikuéra ryguasu ha tekojoja.
grn_035.jpg	Ojehecha petẽi grupo ypýga Guaraní ojerure haguã petẽi tata yvytére. Ko tapicha kuéra oñemohenda tata reheve, imba'e tee ha teko reko rupive. Ko'ápe oñemombe'u pe culture Guaraní tee ha vy'aite.
grn_036.jpg	Mate cup made of wood with the flags of Paraguay and the inscription "Del Paraguay". It is used for drinking tereré or mate, central elements of Paraguayan and Guaraní social identity. This object reflects the fusion of ancestral traditions and national identity.
grn_037.jpg	Plato de comida compuesto por una porción de mandioca o maíz procesado acompañado de un guiso de carne con vegetales y un huevo. Estos ingredientes son fundamentales en la dieta tradicional y cotidiana de Paraguay y las comunidades guaraníes. Refleja la importancia de los productos de la tierra en la gastronomía regional.
grn_038.jpg	Heta tapicha oñembopuku peteĩ plaza-pe, hína peteĩ templóre. Koite opaite umi tapicha oñembopuku haguã ha oñembojegua haguã teko paraguaigua. Ko'ápe ojehecha pe culture paraguái ha guaraní oñemoî ha oikóva.
grn_039.jpg	Chipá ryguasu oĩ hína peteĩ kapi'i tatarãme. Ko tembi'u ha'e peteĩ mba'e pyahúva ha imbareteva Paraguái ha Guaraní kultúrape. Oñembohasa heta arã ha oñeñe'ẽ mimbivéva tekohápe.
grn_040.jpg	Tatata yvytu, tata pyahu. Ko ta'ãnga ha'e peteĩ tata oñemboheréva yvy ári, oñembohasáva teko Paraguái ha Guaraní rembiapo. Oñemoĩ hína ka'aguýpe, ojeipuru haguã rembi'u ñembopohã ha ambue mba'e ñemomboypýre.
grn_041.jpg	Peteĩ ta'ãnga poty guaraní, ojehecha hína haguéva hína peteĩ kapi'i poty. Ko mba'e oñembohusa haguã ypyra térã umi yvytu oñembo'ávo. He'i hína ko poty guaraní teko Paraguái ha imba'erepy rehe.
grn_042.jpg	Heta tapy'ái jave, okañy hína peteĩ ñatã ha iñapyténte peteĩ ñatã michĩmi. Ko yvytu-guyra oje'e ha'e peteĩ tekove iñemíva yvypóra rehe, oñangareko hína haguã iñakãmbyrére. He'i hikuái ko guyra ha'e peteĩ ñembo'e ha ñande reko Paraguáipe.
grn_043.jpg	Peteĩ ta'ãnga Kurupi rehe, umi mitã apytépe ojekuaáva ha’e pe ka’aguy jeguahéva. Ko moñepa ohechauka pe mborayhu ha pe kyhyje oĩva pe yvyra ha ysyry rendápe. Ha'e peteĩ teko mimbipáva Paraguái ha Guaraní rekove guasúpe.
grn_044.jpg	Sopa paraguaya. Ko ta'ãnga ha'e peteĩ mborayhu ha tekopyry guaraní, ojehechauka haguã pe mborayhu ha pe joaju teko paraguaiguápe. He'i hína peteĩ chipa so'o, ojekuaa hína mborayhu ha tekopyry.
grn_045.jpg	mokõ kuña Guaraní oñembo'yha peteĩ ka'aguýpe, oñembo'y hikuái horyryry. Oñembo'y hikuái iñemoñã teko mimbipa ha ijyva guaraní teko rehe. Ko ta'ãnga ohechauka pe mborayhu ha pe tekojoja oĩva kuña Guaranípe.
grn_046.jpg	Oñemombe'u peteĩ ta'ãnga yvyra hovy ha tatei ndive, ojekuaáva oguerekóva tekoteju. Ko tembiapo ohechauka pe mbo'ehao guaraní ha iñemíva tekoha Paraguáipe. He'i hína pe ñembo'e ha pe teko porã oñemomba'e haguã.
grn_047.jpg	Peteĩ guyra iñembyryry hína hína pevã mbykyta rupi. Ko guyra ha iñembovera katu he'i ñande rekove ha ñande yvy Paraguáipe. Ko'ápe ojehecha pe tekove itúva ha iñemboheréi ha'e ñande yvyra ha ysyry.
grn_048.jpg	Peteĩ kuatia'y térã óga guaraníme, ojehecha ijyva ha iatete yvyrágui ha iñatete paja guasúgui. Ko óga ha'ete teko porã ha iñemyasãi ñande reko Paraguáipe. Ojehecha peteĩ kuña ijyvape, oikóva ko tekoha rupi.
grn_049.jpg	Sopa Paraguái (Sopa Paraguaia) héra ko tembi'u, ha'e peteĩ soperã katuete. Ko tembi'u ha'e peteĩ mba'e tekohápe iñembopýva, ojejapóva avati ha kapi'i ndive. Ohechauka pe culture paraguáiguápe ha pe mborayhu oĩva ñembo'e ha tekopýpe.
grn_050.jpg	Mandi'o hovy térã mandi'o vaka. Ko'ápe oĩ umi yvyra iñembohýva, ha ha'e peteĩ tembi'u guasu ha tekotevẽ etéva guaraníkuérape ha Paraguayme. Ojeipuru heta mba'épe, ha ha'e yvyra iñambueháva tembi'u pyahúpe.
